{
  "$schema": "https://localghost.ai/schemas/freehold-v1.json",
  "version": "1.0",
  "updated": "2025-12-25T00:00:00Z",
  "project": {
    "name": "LocalGhost.ai",
    "description": "Private hardware for your digital life. Local AI, encrypted mesh backups, zero cloud dependency.",
    "url": "https://localghost.ai",
    "logo": "https://localghost.ai/images/logo.svg",
    "repository": "https://github.com/LocalGhostDao",
    "license": "MIT",
    "created": "2025-12-18"
  },
  "maintainer": {
    "name": "LocalGhost",
    "contact": "info@localghost.ai",
    "pgp": "https://localghost.ai/.well-known/pgp-key.asc"
  },
  "freehold": {
    "local_first": true,
    "offline_capable": true,
    "no_remote_kill_switch": true,
    "no_mandatory_auth_server": true,
    "data_export": {
      "format": "json",
      "complete": true
    }
  }
}